<?xml version="1.0" encoding="UTF-8"?>
<!DOCTYPE xdrs-output SYSTEM "src/dtd/xdrs.dtd">
<xdrs-output version="'boxer v1.00 (unix build on 21 May 2021, 16:29:40)'">
<!-- A dog with a golden coat is in the water --> 

<xdrs xml:id="xdrs1">
 <taggedtokens>
  <tagtoken xml:id="i1001">
   <tags>
     <tag type="verbnet" n="0">[]</tag>
     <tag type="tok">A</tag>
     <tag type="cat">np/n</tag>
     <tag type="sym">a</tag>
     <tag type="lemma">a</tag>
     <tag type="from">0</tag>
     <tag type="to">1</tag>
     <tag type="pos">DT</tag>
     <tag type="sem">DIS</tag>
     <tag type="wordnet">O</tag>
   </tags>
  </tagtoken>
  <tagtoken xml:id="i1002">
   <tags>
     <tag type="verbnet" n="0">[]</tag>
     <tag type="tok">dog</tag>
     <tag type="cat">n</tag>
     <tag type="sym">dog</tag>
     <tag type="lemma">dog</tag>
     <tag type="from">2</tag>
     <tag type="to">5</tag>
     <tag type="pos">NN</tag>
     <tag type="sem">CON</tag>
     <tag type="wordnet">dog.n.01</tag>
   </tags>
  </tagtoken>
  <tagtoken xml:id="i1003">
   <tags>
     <tag type="tok">with</tag>
     <tag type="cat">(n\n)/np</tag>
     <tag type="sym">with</tag>
     <tag type="lemma">with</tag>
     <tag type="from">6</tag>
     <tag type="to">10</tag>
     <tag type="pos">IN</tag>
     <tag type="sem">REL</tag>
     <tag type="wordnet">O</tag>
     <tag type="verbnet" n="1">[Instrument]</tag>
   </tags>
  </tagtoken>
  <tagtoken xml:id="i1004">
   <tags>
     <tag type="verbnet" n="0">[]</tag>
     <tag type="tok">a</tag>
     <tag type="cat">np/n</tag>
     <tag type="sym">a</tag>
     <tag type="lemma">a</tag>
     <tag type="from">11</tag>
     <tag type="to">12</tag>
     <tag type="pos">DT</tag>
     <tag type="sem">DIS</tag>
     <tag type="wordnet">O</tag>
   </tags>
  </tagtoken>
  <tagtoken xml:id="i1005">
   <tags>
     <tag type="tok">golden</tag>
     <tag type="cat">n/n</tag>
     <tag type="sym">golden</tag>
     <tag type="lemma">golden</tag>
     <tag type="from">13</tag>
     <tag type="to">19</tag>
     <tag type="pos">JJ</tag>
     <tag type="sem">IST</tag>
     <tag type="wordnet">O</tag>
     <tag type="verbnet" n="1">[Attribute]</tag>
   </tags>
  </tagtoken>
  <tagtoken xml:id="i1006">
   <tags>
     <tag type="verbnet" n="0">[]</tag>
     <tag type="tok">coat</tag>
     <tag type="cat">n</tag>
     <tag type="sym">coat</tag>
     <tag type="lemma">coat</tag>
     <tag type="from">20</tag>
     <tag type="to">24</tag>
     <tag type="pos">NN</tag>
     <tag type="sem">CON</tag>
     <tag type="wordnet">coat.n.03</tag>
   </tags>
  </tagtoken>
  <tagtoken xml:id="i1007">
   <tags>
     <tag type="tok">is</tag>
     <tag type="cat">(s:dcl\np)/pp</tag>
     <tag type="sym">be</tag>
     <tag type="lemma">be</tag>
     <tag type="from">25</tag>
     <tag type="to">27</tag>
     <tag type="pos">VBZ</tag>
     <tag type="sem">ENS</tag>
     <tag type="wordnet">O</tag>
     <tag type="verbnet" n="1">[Theme]</tag>
   </tags>
  </tagtoken>
  <tagtoken xml:id="i1008">
   <tags>
     <tag type="tok">in</tag>
     <tag type="cat">pp/np</tag>
     <tag type="sym">in</tag>
     <tag type="lemma">in</tag>
     <tag type="from">28</tag>
     <tag type="to">30</tag>
     <tag type="pos">IN</tag>
     <tag type="sem">REL</tag>
     <tag type="wordnet">O</tag>
     <tag type="verbnet" n="1">[Location]</tag>
   </tags>
  </tagtoken>
  <tagtoken xml:id="i1009">
   <tags>
     <tag type="verbnet" n="0">[]</tag>
     <tag type="tok">the</tag>
     <tag type="cat">np/n</tag>
     <tag type="sym">the</tag>
     <tag type="lemma">the</tag>
     <tag type="from">31</tag>
     <tag type="to">34</tag>
     <tag type="pos">DT</tag>
     <tag type="sem">DEF</tag>
     <tag type="wordnet">O</tag>
   </tags>
  </tagtoken>
  <tagtoken xml:id="i1010">
   <tags>
     <tag type="verbnet" n="0">[]</tag>
     <tag type="tok">water</tag>
     <tag type="cat">n</tag>
     <tag type="sym">water</tag>
     <tag type="lemma">water</tag>
     <tag type="from">35</tag>
     <tag type="to">40</tag>
     <tag type="pos">NN</tag>
     <tag type="sem">CON</tag>
     <tag type="wordnet">water.n.02</tag>
   </tags>
  </tagtoken>
 </taggedtokens>
 <drs label="b1">
  <domain>
   <dr label="b1" name="x1" from="0" to="1"></dr>
   <dr label="b1" name="x2" from="11" to="12"></dr>
   <dr label="b1" name="s1" from="13" to="19"></dr>
   <dr label="b1" name="e1" from="25" to="27"></dr>
   <dr label="b2" name="x3" from="31" to="34"></dr>
   <dr label="b1" name="t1" from="25" to="27"></dr>
  </domain>
  <conds>
   <cond label="b1">
    <pred arg="x1" symbol="dog" synset="dog.n.01" from="2" to="5"></pred>
   </cond>
   <cond label="b1">
    <rel arg1="x1" arg2="x2" symbol="Instrument" framenet="Instrument" from="6" to="10"></rel>
   </cond>
   <cond label="b1">
    <pred arg="s1" symbol="golden" synset="golden.a.01" from="13" to="19"></pred>
   </cond>
   <cond label="b1">
    <rel arg1="s1" arg2="x2" symbol="AttributeOf" framenet="AttributeOf" from="13" to="19"></rel>
   </cond>
   <cond label="b1">
    <pred arg="x2" symbol="coat" synset="coat.n.03" from="20" to="24"></pred>
   </cond>
   <cond label="b1">
    <pred arg="t1" symbol="time" synset="time.n.08" from="25" to="27"></pred>
   </cond>
   <cond label="b1">
    <comp symbol="EQU" arg1="t1" arg2="now" from="25" to="27"></comp>
   </cond>
   <cond label="b1">
    <pred arg="e1" symbol="be" synset="be.v.01" from="25" to="27"></pred>
   </cond>
   <cond label="b1">
    <rel arg1="e1" arg2="t1" symbol="Time" framenet="Time" from="25" to="27"></rel>
   </cond>
   <cond label="b1">
    <rel arg1="e1" arg2="x3" symbol="Location" framenet="Containing@Container" from="28" to="30"></rel>
   </cond>
   <cond label="b1">
    <rel arg1="e1" arg2="x1" symbol="Theme" framenet="Placing@Theme" from="25" to="27"></rel>
   </cond>
   <cond label="b2">
    <pred arg="x3" symbol="water" synset="water.n.02" from="35" to="40"></pred>
   </cond>
  </conds>
 </drs>
</xdrs>
</xdrs-output>
