<?xml version="1.0" encoding="UTF-8"?>
<!DOCTYPE xdrs-output SYSTEM "src/dtd/xdrs.dtd">
<xdrs-output version="'boxer v1.00 (unix build on 21 May 2021, 16:29:40)'">
<!-- A boy is running through the sand --> 

<xdrs xml:id="xdrs1">
 <taggedtokens>
  <tagtoken xml:id="i1001">
   <tags>
     <tag type="verbnet" n="0">[]</tag>
     <tag type="tok">A</tag>
     <tag type="cat">np/n</tag>
     <tag type="sym">a</tag>
     <tag type="lemma">a</tag>
     <tag type="from">0</tag>
     <tag type="to">1</tag>
     <tag type="pos">DT</tag>
     <tag type="sem">DIS</tag>
     <tag type="wordnet">O</tag>
   </tags>
  </tagtoken>
  <tagtoken xml:id="i1002">
   <tags>
     <tag type="verbnet" n="0">[]</tag>
     <tag type="tok">boy</tag>
     <tag type="cat">n</tag>
     <tag type="sym">boy</tag>
     <tag type="lemma">boy</tag>
     <tag type="from">2</tag>
     <tag type="to">5</tag>
     <tag type="pos">NN</tag>
     <tag type="sem">CON</tag>
     <tag type="wordnet">boy.n.01</tag>
   </tags>
  </tagtoken>
  <tagtoken xml:id="i1003">
   <tags>
     <tag type="verbnet" n="0">[]</tag>
     <tag type="tok">is</tag>
     <tag type="cat">(s:dcl\np)/(s:ng\np)</tag>
     <tag type="sym">be</tag>
     <tag type="lemma">be</tag>
     <tag type="from">6</tag>
     <tag type="to">8</tag>
     <tag type="pos">VBZ</tag>
     <tag type="sem">NOW</tag>
     <tag type="wordnet">O</tag>
   </tags>
  </tagtoken>
  <tagtoken xml:id="i1004">
   <tags>
     <tag type="tok">running</tag>
     <tag type="cat">s:ng\np</tag>
     <tag type="sym">run</tag>
     <tag type="lemma">run</tag>
     <tag type="from">9</tag>
     <tag type="to">16</tag>
     <tag type="pos">VBG</tag>
     <tag type="sem">EXG</tag>
     <tag type="wordnet">O</tag>
     <tag type="verbnet" n="1">[Theme]</tag>
   </tags>
  </tagtoken>
  <tagtoken xml:id="i1005">
   <tags>
     <tag type="tok">through</tag>
     <tag type="cat">((s:dcl\np)\(s:dcl\np))/np</tag>
     <tag type="sym">through</tag>
     <tag type="lemma">through</tag>
     <tag type="from">17</tag>
     <tag type="to">24</tag>
     <tag type="pos">IN</tag>
     <tag type="sem">REL</tag>
     <tag type="wordnet">O</tag>
     <tag type="verbnet" n="1">[Path]</tag>
   </tags>
  </tagtoken>
  <tagtoken xml:id="i1006">
   <tags>
     <tag type="verbnet" n="0">[]</tag>
     <tag type="tok">the</tag>
     <tag type="cat">np/n</tag>
     <tag type="sym">the</tag>
     <tag type="lemma">the</tag>
     <tag type="from">25</tag>
     <tag type="to">28</tag>
     <tag type="pos">DT</tag>
     <tag type="sem">DEF</tag>
     <tag type="wordnet">O</tag>
   </tags>
  </tagtoken>
  <tagtoken xml:id="i1007">
   <tags>
     <tag type="verbnet" n="0">[]</tag>
     <tag type="tok">sand</tag>
     <tag type="cat">n</tag>
     <tag type="sym">sand</tag>
     <tag type="lemma">sand</tag>
     <tag type="from">29</tag>
     <tag type="to">33</tag>
     <tag type="pos">NN</tag>
     <tag type="sem">CON</tag>
     <tag type="wordnet">sand.n.01</tag>
   </tags>
  </tagtoken>
 </taggedtokens>
 <drs label="b1">
  <domain>
   <dr label="b1" name="x1" from="0" to="1"></dr>
   <dr label="b1" name="e1" from="9" to="16"></dr>
   <dr label="b1" name="t1" from="6" to="8"></dr>
   <dr label="b2" name="x2" from="25" to="28"></dr>
  </domain>
  <conds>
   <cond label="b1">
    <pred arg="x1" symbol="boy" synset="boy.n.01" from="2" to="5"></pred>
   </cond>
   <cond label="b1">
    <pred arg="t1" symbol="time" synset="time.n.08" from="6" to="8"></pred>
   </cond>
   <cond label="b1">
    <comp symbol="EQU" arg1="t1" arg2="now" from="6" to="8"></comp>
   </cond>
   <cond label="b1">
    <pred arg="e1" symbol="run" synset="run.v.01" from="9" to="16"></pred>
   </cond>
   <cond label="b1">
    <rel arg1="e1" arg2="x2" symbol="Path" framenet="Path" from="17" to="24"></rel>
   </cond>
   <cond label="b1">
    <rel arg1="e1" arg2="t1" symbol="Time" framenet="Time" from="6" to="8"></rel>
   </cond>
   <cond label="b1">
    <rel arg1="e1" arg2="x1" symbol="Theme" framenet="Impact@Impactor" from="9" to="16"></rel>
   </cond>
   <cond label="b2">
    <pred arg="x2" symbol="sand" synset="sand.n.01" from="29" to="33"></pred>
   </cond>
  </conds>
 </drs>
</xdrs>
</xdrs-output>
