<?xml version="1.0" encoding="UTF-8"?>
<!DOCTYPE xdrs-output SYSTEM "src/dtd/xdrs.dtd">
<xdrs-output version="'boxer v1.00 (unix build on 21 May 2021, 16:29:40)'">
<!-- Mein Onkel hat mir dieses Buch gekauft . --> 

<xdrs xml:id="xdrs1">
 <taggedtokens>
  <tagtoken xml:id="i1001">
   <tags>
     <tag type="tok">Mein</tag>
     <tag type="cat">np/(n/pp)</tag>
     <tag type="sym">speaker</tag>
     <tag type="lemma">speaker</tag>
     <tag type="from">0</tag>
     <tag type="to">4</tag>
     <tag type="sem">HAS</tag>
     <tag type="wordnet">O</tag>
     <tag type="verbnet" n="1">[Of]</tag>
   </tags>
  </tagtoken>
  <tagtoken xml:id="i1002">
   <tags>
     <tag type="verbnet" n="0">[]</tag>
     <tag type="tok">Onkel</tag>
     <tag type="cat">n/pp</tag>
     <tag type="sym">uncle</tag>
     <tag type="lemma">uncle</tag>
     <tag type="from">5</tag>
     <tag type="to">10</tag>
     <tag type="sem">ROL</tag>
     <tag type="wordnet">uncle.n.01</tag>
   </tags>
  </tagtoken>
  <tagtoken xml:id="i1003">
   <tags>
     <tag type="verbnet" n="0">[]</tag>
     <tag type="tok">hat</tag>
     <tag type="cat">(s:dcl\np)/(s:pt\np)</tag>
     <tag type="sym">hat</tag>
     <tag type="lemma">hat</tag>
     <tag type="from">11</tag>
     <tag type="to">14</tag>
     <tag type="sem">NOW</tag>
     <tag type="wordnet">O</tag>
   </tags>
  </tagtoken>
  <tagtoken xml:id="i1004">
   <tags>
     <tag type="verbnet" n="0">[]</tag>
     <tag type="tok">mir</tag>
     <tag type="cat">np</tag>
     <tag type="sym">speaker</tag>
     <tag type="lemma">speaker</tag>
     <tag type="from">15</tag>
     <tag type="to">18</tag>
     <tag type="sem">PRO</tag>
     <tag type="wordnet">O</tag>
   </tags>
  </tagtoken>
  <tagtoken xml:id="i1005">
   <tags>
     <tag type="verbnet" n="0">[]</tag>
     <tag type="tok">dieses</tag>
     <tag type="cat">np/n</tag>
     <tag type="sym">entity</tag>
     <tag type="lemma">entity</tag>
     <tag type="from">19</tag>
     <tag type="to">25</tag>
     <tag type="sem">PRX</tag>
     <tag type="wordnet">entity.n.01</tag>
   </tags>
  </tagtoken>
  <tagtoken xml:id="i1006">
   <tags>
     <tag type="verbnet" n="0">[]</tag>
     <tag type="tok">Buch</tag>
     <tag type="cat">n</tag>
     <tag type="sym">book</tag>
     <tag type="lemma">book</tag>
     <tag type="from">26</tag>
     <tag type="to">30</tag>
     <tag type="sem">CON</tag>
     <tag type="wordnet">book.n.02</tag>
   </tags>
  </tagtoken>
  <tagtoken xml:id="i1007">
   <tags>
     <tag type="tok">gekauft</tag>
     <tag type="cat">((s:pt\np)\np)\np</tag>
     <tag type="sym">buy</tag>
     <tag type="lemma">buy</tag>
     <tag type="from">31</tag>
     <tag type="to">38</tag>
     <tag type="sem">EXT</tag>
     <tag type="wordnet">buy.v.01</tag>
     <tag type="verbnet" n="3">[Theme,Beneficiary,Agent]</tag>
   </tags>
  </tagtoken>
  <tagtoken xml:id="i1008">
   <tags>
     <tag type="verbnet" n="0">[]</tag>
     <tag type="tok">.</tag>
     <tag type="cat">s:dcl\s:dcl</tag>
     <tag type="sym">.</tag>
     <tag type="lemma">.</tag>
     <tag type="from">38</tag>
     <tag type="to">39</tag>
     <tag type="sem">NIL</tag>
     <tag type="wordnet">O</tag>
   </tags>
  </tagtoken>
 </taggedtokens>
 <drs label="b2">
  <domain>
   <dr label="b1" name="x1" from="0" to="4"></dr>
   <dr label="b1" name="x2" from="5" to="10"></dr>
   <dr label="b2" name="x3" from="15" to="18"></dr>
   <dr label="b3" name="x4" from="19" to="25"></dr>
   <dr label="b2" name="e1" from="31" to="38"></dr>
   <dr label="b2" name="t1" from="31" to="38"></dr>
  </domain>
  <conds>
   <cond label="b1">
    <pred arg="x2" symbol="uncle" synset="uncle.n.01" from="5" to="10"></pred>
   </cond>
   <cond label="b1">
    <rel arg1="x2" arg2="speaker" symbol="Of" framenet="Of" from="0" to="4"></rel>
   </cond>
   <cond label="b1">
    <pred arg="x1" symbol="person" synset="person.n.01" from="5" to="10"></pred>
   </cond>
   <cond label="b1">
    <rel arg1="x1" arg2="x2" symbol="Role" framenet="Role" from="5" to="10"></rel>
   </cond>
   <cond label="b2">
    <pred arg="x3" symbol="person" synset="person.n.01" from="15" to="18"></pred>
   </cond>
   <cond label="b2">
    <comp symbol="EQU" arg1="x3" arg2="speaker" from="15" to="18"></comp>
   </cond>
   <cond label="b3">
    <pred arg="x4" symbol="book" synset="book.n.02" from="26" to="30"></pred>
   </cond>
   <cond label="b2">
    <pred arg="t1" symbol="time" synset="time.n.08" from="31" to="38"></pred>
   </cond>
   <cond label="b2">
    <comp symbol="TPR" arg1="t1" arg2="now" from="31" to="38"></comp>
   </cond>
   <cond label="b2">
    <pred arg="e1" symbol="buy" synset="buy.v.01" from="31" to="38"></pred>
   </cond>
   <cond label="b2">
    <rel arg1="e1" arg2="t1" symbol="Time" framenet="Time" from="31" to="38"></rel>
   </cond>
   <cond label="b2">
    <rel arg1="e1" arg2="x4" symbol="Theme" framenet="Commerce_buy@Goods" from="31" to="38"></rel>
   </cond>
   <cond label="b2">
    <rel arg1="e1" arg2="x3" symbol="Beneficiary" framenet="Claim_ownership@Beneficiary" from="31" to="38"></rel>
   </cond>
   <cond label="b2">
    <rel arg1="e1" arg2="x1" symbol="Agent" framenet="Commerce_buy@Buyer" from="31" to="38"></rel>
   </cond>
  </conds>
 </drs>
</xdrs>
</xdrs-output>
