<?xml version="1.0" encoding="UTF-8"?>
<!DOCTYPE xdrs-output SYSTEM "src/dtd/xdrs.dtd">
<xdrs-output version="'boxer v1.00 (unix build on 21 May 2021, 16:29:40)'">
<!-- A Seadoo is being ridden by a woman --> 

<xdrs xml:id="xdrs1">
 <taggedtokens>
  <tagtoken xml:id="i1001">
   <tags>
     <tag type="verbnet" n="0">[]</tag>
     <tag type="tok">A</tag>
     <tag type="cat">np/n</tag>
     <tag type="sym">a</tag>
     <tag type="lemma">a</tag>
     <tag type="from">0</tag>
     <tag type="to">1</tag>
     <tag type="pos">DT</tag>
     <tag type="sem">DIS</tag>
     <tag type="wordnet">O</tag>
   </tags>
  </tagtoken>
  <tagtoken xml:id="i1002">
   <tags>
     <tag type="verbnet" n="0">[]</tag>
     <tag type="tok">Seadoo</tag>
     <tag type="cat">n</tag>
     <tag type="sym">seadoo</tag>
     <tag type="lemma">seadoo</tag>
     <tag type="from">2</tag>
     <tag type="to">8</tag>
     <tag type="pos">NN</tag>
     <tag type="sem">CON</tag>
     <tag type="wordnet">O</tag>
   </tags>
  </tagtoken>
  <tagtoken xml:id="i1003">
   <tags>
     <tag type="verbnet" n="0">[]</tag>
     <tag type="tok">is</tag>
     <tag type="cat">(s:dcl\np)/(s:ng\np)</tag>
     <tag type="sym">be</tag>
     <tag type="lemma">be</tag>
     <tag type="from">9</tag>
     <tag type="to">11</tag>
     <tag type="pos">VBZ</tag>
     <tag type="sem">NOW</tag>
     <tag type="wordnet">O</tag>
   </tags>
  </tagtoken>
  <tagtoken xml:id="i1004">
   <tags>
     <tag type="verbnet" n="0">[]</tag>
     <tag type="tok">being</tag>
     <tag type="cat">(s:ng\np)/(s:pss\np)</tag>
     <tag type="sym">be</tag>
     <tag type="lemma">be</tag>
     <tag type="from">12</tag>
     <tag type="to">17</tag>
     <tag type="pos">VBG</tag>
     <tag type="sem">PRG</tag>
     <tag type="wordnet">O</tag>
   </tags>
  </tagtoken>
  <tagtoken xml:id="i1005">
   <tags>
     <tag type="tok">ridden</tag>
     <tag type="cat">s:pss\np</tag>
     <tag type="sym">ride</tag>
     <tag type="lemma">ride</tag>
     <tag type="from">18</tag>
     <tag type="to">24</tag>
     <tag type="pos">VBN</tag>
     <tag type="sem">EXT</tag>
     <tag type="wordnet">O</tag>
     <tag type="verbnet" n="1">[Theme]</tag>
   </tags>
  </tagtoken>
  <tagtoken xml:id="i1006">
   <tags>
     <tag type="tok">by</tag>
     <tag type="cat">((s:dcl\np)\(s:dcl\np))/np</tag>
     <tag type="sym">by</tag>
     <tag type="lemma">by</tag>
     <tag type="from">25</tag>
     <tag type="to">27</tag>
     <tag type="pos">IN</tag>
     <tag type="sem">REL</tag>
     <tag type="wordnet">O</tag>
     <tag type="verbnet" n="1">[Agent]</tag>
   </tags>
  </tagtoken>
  <tagtoken xml:id="i1007">
   <tags>
     <tag type="verbnet" n="0">[]</tag>
     <tag type="tok">a</tag>
     <tag type="cat">np/n</tag>
     <tag type="sym">a</tag>
     <tag type="lemma">a</tag>
     <tag type="from">28</tag>
     <tag type="to">29</tag>
     <tag type="pos">DT</tag>
     <tag type="sem">DIS</tag>
     <tag type="wordnet">O</tag>
   </tags>
  </tagtoken>
  <tagtoken xml:id="i1008">
   <tags>
     <tag type="verbnet" n="0">[]</tag>
     <tag type="tok">woman</tag>
     <tag type="cat">n</tag>
     <tag type="sym">woman</tag>
     <tag type="lemma">woman</tag>
     <tag type="from">30</tag>
     <tag type="to">35</tag>
     <tag type="pos">NN</tag>
     <tag type="sem">CON</tag>
     <tag type="wordnet">woman.n.01</tag>
   </tags>
  </tagtoken>
 </taggedtokens>
 <drs label="b1">
  <domain>
   <dr label="b1" name="x1" from="0" to="1"></dr>
   <dr label="b1" name="e1" from="18" to="24"></dr>
   <dr label="b1" name="t1" from="18" to="24"></dr>
   <dr label="b1" name="t2" from="9" to="11"></dr>
   <dr label="b1" name="x2" from="28" to="29"></dr>
  </domain>
  <conds>
   <cond label="b1">
    <pred arg="x1" symbol="seadoo" synset="seadoo.n.01" from="2" to="8"></pred>
   </cond>
   <cond label="b1">
    <pred arg="t2" symbol="time" synset="time.n.08" from="9" to="11"></pred>
   </cond>
   <cond label="b1">
    <comp symbol="EQU" arg1="t2" arg2="now" from="9" to="11"></comp>
   </cond>
   <cond label="b1">
    <pred arg="e1" symbol="ride" synset="ride.v.01" from="18" to="24"></pred>
   </cond>
   <cond label="b1">
    <rel arg1="e1" arg2="x2" symbol="Agent" framenet="Assistance@Helper" from="25" to="27"></rel>
   </cond>
   <cond label="b1">
    <rel arg1="e1" arg2="t2" symbol="Time" framenet="Time" from="9" to="11"></rel>
   </cond>
   <cond label="b1">
    <rel arg1="e1" arg2="t1" symbol="Time" framenet="Time" from="18" to="24"></rel>
   </cond>
   <cond label="b1">
    <rel arg1="e1" arg2="x1" symbol="Theme" framenet="Carry_goods@Goods" from="18" to="24"></rel>
   </cond>
   <cond label="b1">
    <pred arg="t1" symbol="time" synset="time.n.08" from="18" to="24"></pred>
   </cond>
   <cond label="b1">
    <comp symbol="TPR" arg1="t1" arg2="now" from="18" to="24"></comp>
   </cond>
   <cond label="b1">
    <pred arg="x2" symbol="woman" synset="woman.n.01" from="30" to="35"></pred>
   </cond>
  </conds>
 </drs>
</xdrs>
</xdrs-output>
