<?xml version="1.0" encoding="UTF-8"?>
<!DOCTYPE xdrs-output SYSTEM "src/dtd/xdrs.dtd">
<xdrs-output version="'boxer v1.00 (unix build on 21 May 2021, 16:29:40)'">
<!-- I have run out of my traveling expenses . --> 

<xdrs xml:id="xdrs1">
 <taggedtokens>
  <tagtoken xml:id="i1001">
   <tags>
     <tag type="verbnet" n="0">[]</tag>
     <tag type="tok">I</tag>
     <tag type="cat">np</tag>
     <tag type="sym">speaker</tag>
     <tag type="lemma">speaker</tag>
     <tag type="from">0</tag>
     <tag type="to">1</tag>
     <tag type="pos">PRP</tag>
     <tag type="sem">PRO</tag>
     <tag type="wordnet">O</tag>
   </tags>
  </tagtoken>
  <tagtoken xml:id="i1002">
   <tags>
     <tag type="verbnet" n="0">[]</tag>
     <tag type="tok">have</tag>
     <tag type="cat">(s:dcl\np)/(s:pt\np)</tag>
     <tag type="sym">have</tag>
     <tag type="lemma">have</tag>
     <tag type="from">2</tag>
     <tag type="to">6</tag>
     <tag type="pos">VBP</tag>
     <tag type="sem">NEC</tag>
     <tag type="wordnet">O</tag>
   </tags>
  </tagtoken>
  <tagtoken xml:id="i1003">
   <tags>
     <tag type="tok">run</tag>
     <tag type="cat">s:pt\np</tag>
     <tag type="sym">run</tag>
     <tag type="lemma">run</tag>
     <tag type="from">7</tag>
     <tag type="to">10</tag>
     <tag type="pos">VBN</tag>
     <tag type="sem">EXS</tag>
     <tag type="wordnet">O</tag>
     <tag type="verbnet" n="1">[Theme]</tag>
   </tags>
  </tagtoken>
  <tagtoken xml:id="i1004">
   <tags>
     <tag type="verbnet" n="0">[]</tag>
     <tag type="tok">out</tag>
     <tag type="cat">((s:dcl\np)\(s:dcl\np))/pp</tag>
     <tag type="sym">out</tag>
     <tag type="lemma">out</tag>
     <tag type="from">11</tag>
     <tag type="to">14</tag>
     <tag type="pos">IN</tag>
     <tag type="sem">REL</tag>
     <tag type="wordnet">O</tag>
   </tags>
  </tagtoken>
  <tagtoken xml:id="i1005">
   <tags>
     <tag type="tok">of</tag>
     <tag type="cat">pp/np</tag>
     <tag type="sym">of</tag>
     <tag type="lemma">of</tag>
     <tag type="from">15</tag>
     <tag type="to">17</tag>
     <tag type="pos">IN</tag>
     <tag type="sem">REL</tag>
     <tag type="wordnet">O</tag>
     <tag type="verbnet" n="1">[Theme]</tag>
   </tags>
  </tagtoken>
  <tagtoken xml:id="i1006">
   <tags>
     <tag type="tok">my</tag>
     <tag type="cat">np/(n/pp)</tag>
     <tag type="sym">speaker</tag>
     <tag type="lemma">speaker</tag>
     <tag type="from">18</tag>
     <tag type="to">20</tag>
     <tag type="pos">PRP$</tag>
     <tag type="sem">HAS</tag>
     <tag type="wordnet">O</tag>
     <tag type="verbnet" n="1">[Of]</tag>
   </tags>
  </tagtoken>
  <tagtoken xml:id="i1007">
   <tags>
     <tag type="tok">traveling</tag>
     <tag type="cat">n/n</tag>
     <tag type="sym">travel</tag>
     <tag type="lemma">travel</tag>
     <tag type="from">21</tag>
     <tag type="to">30</tag>
     <tag type="pos">VBG</tag>
     <tag type="sem">EXG</tag>
     <tag type="wordnet">O</tag>
     <tag type="verbnet" n="1">[Theme]</tag>
   </tags>
  </tagtoken>
  <tagtoken xml:id="i1008">
   <tags>
     <tag type="verbnet" n="0">[]</tag>
     <tag type="tok">expenses</tag>
     <tag type="cat">n/pp</tag>
     <tag type="sym">expense</tag>
     <tag type="lemma">expense</tag>
     <tag type="from">31</tag>
     <tag type="to">39</tag>
     <tag type="pos">NNS</tag>
     <tag type="sem">CON</tag>
     <tag type="wordnet">O</tag>
   </tags>
  </tagtoken>
  <tagtoken xml:id="i1009">
   <tags>
     <tag type="verbnet" n="0">[]</tag>
     <tag type="tok">.</tag>
     <tag type="cat">s:dcl\s:dcl</tag>
     <tag type="sym">.</tag>
     <tag type="lemma">.</tag>
     <tag type="from">39</tag>
     <tag type="to">40</tag>
     <tag type="pos">.</tag>
     <tag type="sem">NIL</tag>
     <tag type="wordnet">O</tag>
   </tags>
  </tagtoken>
 </taggedtokens>
 <drs label="b1">
  <domain>
   <dr label="b1" name="x1" from="0" to="1"></dr>
  </domain>
  <conds>
   <cond label="b1">
    <pred arg="x1" symbol="person" synset="person.n.01" from="0" to="1"></pred>
   </cond>
   <cond label="b1">
    <comp symbol="EQU" arg1="x1" arg2="speaker" from="0" to="1"></comp>
   </cond>
   <cond label="b1">
    <nec from="2" to="6">
     <drs label="b2">
      <domain>
       <dr label="b2" name="e1" from="7" to="10"></dr>
       <dr label="b2" name="x2" from="11" to="14"></dr>
       <dr label="b3" name="x3" from="18" to="20"></dr>
       <dr label="b3" name="e2" from="21" to="30"></dr>
      </domain>
      <conds>
       <cond label="b2">
        <pred arg="e1" symbol="run" synset="run.v.01" from="7" to="10"></pred>
       </cond>
       <cond label="b2">
        <rel arg1="e1" arg2="x2" symbol="Causer" framenet="Causer" from="11" to="14"></rel>
       </cond>
       <cond label="b2">
        <rel arg1="e1" arg2="x1" symbol="Theme" framenet="Impact@Impactor" from="7" to="10"></rel>
       </cond>
       <cond label="b2">
        <pred arg="x2" symbol="entity" synset="entity.n.01" from="11" to="14"></pred>
       </cond>
       <cond label="b2">
        <rel arg1="x2" arg2="x3" symbol="Theme" framenet="Emptying@Theme" from="15" to="17"></rel>
       </cond>
       <cond label="b3">
        <pred arg="x3" symbol="expense" synset="expense.n.01" from="31" to="39"></pred>
       </cond>
       <cond label="b3">
        <rel arg1="x3" arg2="speaker" symbol="Of" framenet="Of" from="18" to="20"></rel>
       </cond>
       <cond label="b3">
        <pred arg="e2" symbol="travel" synset="travel.v.01" from="21" to="30"></pred>
       </cond>
       <cond label="b3">
        <rel arg1="e2" arg2="x3" symbol="Theme" framenet="Theme" from="21" to="30"></rel>
       </cond>
      </conds>
     </drs>
    </nec>
   </cond>
  </conds>
 </drs>
</xdrs>
</xdrs-output>
