<?xml version="1.0" encoding="UTF-8"?>
<!DOCTYPE xdrs-output SYSTEM "src/dtd/xdrs.dtd">
<xdrs-output version="'boxer v1.00 (unix build on 21 May 2021, 16:29:40)'">
<!-- I Yakuza sono la mafia giapponese . --> 

<xdrs xml:id="xdrs1">
 <taggedtokens>
  <tagtoken xml:id="i1001">
   <tags>
     <tag type="verbnet" n="0">[]</tag>
     <tag type="tok">I</tag>
     <tag type="cat">np/n</tag>
     <tag type="sym">the</tag>
     <tag type="lemma">the</tag>
     <tag type="from">0</tag>
     <tag type="to">1</tag>
     <tag type="sem">DEF</tag>
     <tag type="wordnet">O</tag>
   </tags>
  </tagtoken>
  <tagtoken xml:id="i1002">
   <tags>
     <tag type="verbnet" n="0">[]</tag>
     <tag type="tok">Yakuza</tag>
     <tag type="cat">n</tag>
     <tag type="sym">yakuza</tag>
     <tag type="lemma">yakuza</tag>
     <tag type="from">2</tag>
     <tag type="to">8</tag>
     <tag type="sem">CON</tag>
     <tag type="wordnet">yakuza.n.02</tag>
   </tags>
  </tagtoken>
  <tagtoken xml:id="i1003">
   <tags>
     <tag type="tok">sono</tag>
     <tag type="cat">(s:dcl\np)/np</tag>
     <tag type="sym">be</tag>
     <tag type="lemma">be</tag>
     <tag type="from">9</tag>
     <tag type="to">13</tag>
     <tag type="sem">ENS</tag>
     <tag type="wordnet">be.v.02</tag>
     <tag type="verbnet" n="2">[Co-Theme,Theme]</tag>
   </tags>
  </tagtoken>
  <tagtoken xml:id="i1004">
   <tags>
     <tag type="verbnet" n="0">[]</tag>
     <tag type="tok">la</tag>
     <tag type="cat">np/n</tag>
     <tag type="sym">the</tag>
     <tag type="lemma">the</tag>
     <tag type="from">14</tag>
     <tag type="to">16</tag>
     <tag type="sem">DEF</tag>
     <tag type="wordnet">O</tag>
   </tags>
  </tagtoken>
  <tagtoken xml:id="i1005">
   <tags>
     <tag type="verbnet" n="0">[]</tag>
     <tag type="tok">mafia</tag>
     <tag type="cat">n</tag>
     <tag type="sym">mafia</tag>
     <tag type="lemma">mafia</tag>
     <tag type="from">17</tag>
     <tag type="to">22</tag>
     <tag type="sem">CON</tag>
     <tag type="wordnet">mafia.n.01</tag>
   </tags>
  </tagtoken>
  <tagtoken xml:id="i1006">
   <tags>
     <tag type="tok">giapponese</tag>
     <tag type="cat">n\n</tag>
     <tag type="sym">japan</tag>
     <tag type="lemma">japan</tag>
     <tag type="from">23</tag>
     <tag type="to">33</tag>
     <tag type="sem">GPO</tag>
     <tag type="wordnet">country.n.02</tag>
     <tag type="verbnet" n="1">[Location]</tag>
   </tags>
  </tagtoken>
  <tagtoken xml:id="i1007">
   <tags>
     <tag type="verbnet" n="0">[]</tag>
     <tag type="tok">.</tag>
     <tag type="cat">s:dcl\s:dcl</tag>
     <tag type="sym">.</tag>
     <tag type="lemma">.</tag>
     <tag type="from">33</tag>
     <tag type="to">34</tag>
     <tag type="sem">NIL</tag>
     <tag type="wordnet">O</tag>
   </tags>
  </tagtoken>
 </taggedtokens>
 <drs label="b4">
  <domain>
   <dr label="b1" name="x1" from="0" to="1"></dr>
   <dr label="b2" name="x2" from="14" to="16"></dr>
   <dr label="b3" name="x3" from="23" to="33"></dr>
   <dr label="b4" name="e1" from="9" to="13"></dr>
   <dr label="b4" name="t1" from="9" to="13"></dr>
  </domain>
  <conds>
   <cond label="b1">
    <pred arg="x1" symbol="yakuza" synset="yakuza.n.02" from="2" to="8"></pred>
   </cond>
   <cond label="b4">
    <pred arg="t1" symbol="time" synset="time.n.08" from="9" to="13"></pred>
   </cond>
   <cond label="b4">
    <comp symbol="EQU" arg1="t1" arg2="now" from="9" to="13"></comp>
   </cond>
   <cond label="b4">
    <pred arg="e1" symbol="be" synset="be.v.02" from="9" to="13"></pred>
   </cond>
   <cond label="b4">
    <rel arg1="e1" arg2="t1" symbol="Time" framenet="Time" from="9" to="13"></rel>
   </cond>
   <cond label="b4">
    <rel arg1="e1" arg2="x2" symbol="Co-Theme" framenet="Replacing@New" from="9" to="13"></rel>
   </cond>
   <cond label="b4">
    <rel arg1="e1" arg2="x1" symbol="Theme" framenet="Placing@Theme" from="9" to="13"></rel>
   </cond>
   <cond label="b2">
    <pred arg="x2" symbol="mafia" synset="mafia.n.01" from="17" to="22"></pred>
   </cond>
   <cond label="b2">
    <rel arg1="x2" arg2="x3" symbol="Location" framenet="Location" from="23" to="33"></rel>
   </cond>
   <cond label="b3">
    <pred arg="x3" symbol="country" synset="country.n.02" from="23" to="33"></pred>
   </cond>
   <cond label="b3">
    <named arg="x3" symbol="japan" from="23" to="33"></named>
   </cond>
  </conds>
 </drs>
</xdrs>
</xdrs-output>
