<?xml version="1.0" encoding="UTF-8"?>
<!DOCTYPE xdrs-output SYSTEM "src/dtd/xdrs.dtd">
<xdrs-output version="'boxer v1.00 (unix build on 21 May 2021, 16:29:40)'">
<!-- ø Computers worden ø gebruikt om te voorzien in ø gezondheidsinformatie . --> 

<xdrs xml:id="xdrs1">
 <taggedtokens>
  <tagtoken xml:id="i1001">
   <tags>
     <tag type="verbnet" n="0">[]</tag>
     <tag type="tok">ø</tag>
     <tag type="cat">np/n</tag>
     <tag type="wordnet">O</tag>
     <tag type="sense">0</tag>
     <tag type="sym">ø</tag>
     <tag type="lemma">ø</tag>
     <tag type="sem">DEF</tag>
     <tag type="from">0</tag>
     <tag type="to">-1</tag>
   </tags>
  </tagtoken>
  <tagtoken xml:id="i1002">
   <tags>
     <tag type="verbnet" n="0">[]</tag>
     <tag type="tok">Computers</tag>
     <tag type="cat">n</tag>
     <tag type="sym">computers</tag>
     <tag type="lemma">computers</tag>
     <tag type="from">0</tag>
     <tag type="to">9</tag>
     <tag type="sem">PER</tag>
     <tag type="wordnet">O</tag>
   </tags>
  </tagtoken>
  <tagtoken xml:id="i1003">
   <tags>
     <tag type="verbnet" n="0">[]</tag>
     <tag type="tok">worden</tag>
     <tag type="cat">(s:dcl\np)/(s:adj\np)</tag>
     <tag type="sym">worden</tag>
     <tag type="lemma">worden</tag>
     <tag type="from">10</tag>
     <tag type="to">16</tag>
     <tag type="sem">NOW</tag>
     <tag type="wordnet">O</tag>
   </tags>
  </tagtoken>
  <tagtoken xml:id="i1004">
   <tags>
     <tag type="verbnet" n="0">[]</tag>
     <tag type="tok">ø</tag>
     <tag type="cat">(s:dcl/s:dcl)/(s:pss\np)</tag>
     <tag type="wordnet">O</tag>
     <tag type="sense">0</tag>
     <tag type="sym">ø</tag>
     <tag type="lemma">ø</tag>
     <tag type="sem">REL</tag>
     <tag type="from">17</tag>
     <tag type="to">-1</tag>
   </tags>
  </tagtoken>
  <tagtoken xml:id="i1005">
   <tags>
     <tag type="verbnet" n="0">[]</tag>
     <tag type="tok">gebruikt</tag>
     <tag type="cat">s:pss\np</tag>
     <tag type="sym">gebruikt</tag>
     <tag type="lemma">gebruikt</tag>
     <tag type="from">17</tag>
     <tag type="to">25</tag>
     <tag type="sem">EXS</tag>
     <tag type="wordnet">O</tag>
   </tags>
  </tagtoken>
  <tagtoken xml:id="i1006">
   <tags>
     <tag type="verbnet" n="0">[]</tag>
     <tag type="tok">om</tag>
     <tag type="cat">(s:adj\np)/((s:to\np)/np)</tag>
     <tag type="sym">om</tag>
     <tag type="lemma">om</tag>
     <tag type="from">26</tag>
     <tag type="to">28</tag>
     <tag type="sem">REL</tag>
     <tag type="wordnet">O</tag>
   </tags>
  </tagtoken>
  <tagtoken xml:id="i1007">
   <tags>
     <tag type="verbnet" n="0">[]</tag>
     <tag type="tok">te</tag>
     <tag type="cat">(s:to\np)/(s:b\np)</tag>
     <tag type="sym">te</tag>
     <tag type="lemma">te</tag>
     <tag type="from">29</tag>
     <tag type="to">31</tag>
     <tag type="sem">INT</tag>
     <tag type="wordnet">O</tag>
   </tags>
  </tagtoken>
  <tagtoken xml:id="i1008">
   <tags>
     <tag type="verbnet" n="0">[]</tag>
     <tag type="tok">voorzien</tag>
     <tag type="cat">(s:b\np)/np</tag>
     <tag type="sym">voorzien</tag>
     <tag type="lemma">voorzien</tag>
     <tag type="from">32</tag>
     <tag type="to">40</tag>
     <tag type="sem">IST</tag>
     <tag type="wordnet">O</tag>
   </tags>
  </tagtoken>
  <tagtoken xml:id="i1009">
   <tags>
     <tag type="verbnet" n="0">[]</tag>
     <tag type="tok">in</tag>
     <tag type="cat">((s:b\np)\(s:b\np))/np</tag>
     <tag type="sym">in</tag>
     <tag type="lemma">in</tag>
     <tag type="from">41</tag>
     <tag type="to">43</tag>
     <tag type="sem">REL</tag>
     <tag type="wordnet">O</tag>
   </tags>
  </tagtoken>
  <tagtoken xml:id="i1010">
   <tags>
     <tag type="verbnet" n="0">[]</tag>
     <tag type="tok">ø</tag>
     <tag type="cat">np/n</tag>
     <tag type="wordnet">O</tag>
     <tag type="sense">0</tag>
     <tag type="sym">ø</tag>
     <tag type="lemma">ø</tag>
     <tag type="sem">DIS</tag>
     <tag type="from">44</tag>
     <tag type="to">-1</tag>
   </tags>
  </tagtoken>
  <tagtoken xml:id="i1011">
   <tags>
     <tag type="verbnet" n="0">[]</tag>
     <tag type="tok">gezondheidsinformatie</tag>
     <tag type="cat">n</tag>
     <tag type="sym">gezondheidsinformatie</tag>
     <tag type="lemma">gezondheidsinformatie</tag>
     <tag type="from">44</tag>
     <tag type="to">65</tag>
     <tag type="sem">CON</tag>
     <tag type="wordnet">O</tag>
   </tags>
  </tagtoken>
  <tagtoken xml:id="i1012">
   <tags>
     <tag type="verbnet" n="0">[]</tag>
     <tag type="tok">.</tag>
     <tag type="cat">s:dcl\s:dcl</tag>
     <tag type="sym">.</tag>
     <tag type="lemma">.</tag>
     <tag type="from">65</tag>
     <tag type="to">66</tag>
     <tag type="sem">NIL</tag>
     <tag type="wordnet">O</tag>
   </tags>
  </tagtoken>
 </taggedtokens>
 <drs label="b1">
  <domain>
   <dr label="b1" name="x1" from="0" to="0"></dr>
   <dr label="b1" name="e1" from="17" to="25"></dr>
   <dr label="b2" name="x2" from="0" to="-1"></dr>
   <dr label="b1" name="x3" from="26" to="28"></dr>
   <dr label="b1" name="s1" from="32" to="40"></dr>
   <dr label="b1" name="x4" from="44" to="-1"></dr>
   <dr label="b1" name="s2" from="29" to="31"></dr>
   <dr label="b1" name="t1" from="10" to="16"></dr>
  </domain>
  <conds>
   <cond label="b2">
    <pred arg="x2" symbol="person" synset="person.n.01" from="0" to="9"></pred>
   </cond>
   <cond label="b2">
    <named arg="x2" symbol="computers" from="0" to="9"></named>
   </cond>
   <cond label="b1">
    <pred arg="s1" symbol="voorzien" synset="voorzien.a.01" from="32" to="40"></pred>
   </cond>
   <cond label="b1">
    <rel arg1="s1" arg2="e1" symbol="Participant" framenet="Participant" from="0" to="0"></rel>
   </cond>
   <cond label="b1">
    <rel arg1="s1" arg2="t1" symbol="Time" framenet="Time" from="10" to="16"></rel>
   </cond>
   <cond label="b1">
    <rel arg1="s1" arg2="s2" symbol="Degree" framenet="Degree" from="29" to="31"></rel>
   </cond>
   <cond label="b1">
    <rel arg1="s1" arg2="x4" symbol="Instrument" framenet="Apply_heat@Heating_instrument" from="41" to="43"></rel>
   </cond>
   <cond label="b1">
    <rel arg1="s1" arg2="x2" symbol="Theme" framenet="Theme" from="32" to="40"></rel>
   </cond>
   <cond label="b1">
    <rel arg1="s1" arg2="x3" symbol="Agent" framenet="Agent" from="32" to="40"></rel>
   </cond>
   <cond label="b1">
    <pred arg="t1" symbol="time" synset="time.n.08" from="10" to="16"></pred>
   </cond>
   <cond label="b1">
    <comp symbol="EQU" arg1="t1" arg2="now" from="10" to="16"></comp>
   </cond>
   <cond label="b1">
    <pred arg="e1" symbol="gebruikt" synset="gebruikt.v.01" from="17" to="25"></pred>
   </cond>
   <cond label="b1">
    <rel arg1="e1" arg2="x1" symbol="Theme" framenet="Placing@Theme" from="17" to="25"></rel>
   </cond>
   <cond label="b1">
    <pred arg="x3" symbol="entity" synset="entity.n.01" from="26" to="28"></pred>
   </cond>
   <cond label="b1">
    <pred arg="s2" symbol="te" synset="te.r.01" from="29" to="31"></pred>
   </cond>
   <cond label="b1">
    <pred arg="x4" symbol="gezondheidsinformatie" synset="gezondheidsinformatie.n.01" from="44" to="65"></pred>
   </cond>
   <cond label="b1">
    <pred arg="x1" symbol="entity" synset="entity.n.01" from="0" to="0"></pred>
   </cond>
  </conds>
 </drs>
</xdrs>
</xdrs-output>
