<?xml version="1.0" encoding="UTF-8"?>
<!DOCTYPE xdrs-output SYSTEM "src/dtd/xdrs.dtd">
<xdrs-output version="'boxer v1.00 (unix build on 21 May 2021, 16:29:40)'">
<!-- ø Frank was waiting with ø pleasure for the date in the evening . --> 

<xdrs xml:id="xdrs1">
 <taggedtokens>
  <tagtoken xml:id="i1001">
   <tags>
     <tag type="verbnet" n="0">[]</tag>
     <tag type="tok">ø</tag>
     <tag type="cat">np/n</tag>
     <tag type="wordnet">O</tag>
     <tag type="sense">0</tag>
     <tag type="sym">ø</tag>
     <tag type="lemma">ø</tag>
     <tag type="sem">DEF</tag>
     <tag type="from">0</tag>
     <tag type="to">-1</tag>
   </tags>
  </tagtoken>
  <tagtoken xml:id="i1002">
   <tags>
     <tag type="verbnet" n="0">[]</tag>
     <tag type="tok">Frank</tag>
     <tag type="cat">n</tag>
     <tag type="sym">frank</tag>
     <tag type="lemma">frank</tag>
     <tag type="from">0</tag>
     <tag type="to">5</tag>
     <tag type="pos">NNP</tag>
     <tag type="sem">PER</tag>
     <tag type="wordnet">O</tag>
   </tags>
  </tagtoken>
  <tagtoken xml:id="i1003">
   <tags>
     <tag type="verbnet" n="0">[]</tag>
     <tag type="tok">was</tag>
     <tag type="cat">(s:dcl\np)/(s:ng\np)</tag>
     <tag type="sym">be</tag>
     <tag type="lemma">be</tag>
     <tag type="from">6</tag>
     <tag type="to">9</tag>
     <tag type="pos">VBD</tag>
     <tag type="sem">PST</tag>
     <tag type="wordnet">O</tag>
   </tags>
  </tagtoken>
  <tagtoken xml:id="i1004">
   <tags>
     <tag type="tok">waiting</tag>
     <tag type="cat">(s:ng\np)/pp</tag>
     <tag type="sym">wait</tag>
     <tag type="lemma">wait</tag>
     <tag type="from">10</tag>
     <tag type="to">17</tag>
     <tag type="pos">VBG</tag>
     <tag type="sem">EXG</tag>
     <tag type="wordnet">O</tag>
     <tag type="verbnet" n="1">[Location]</tag>
   </tags>
  </tagtoken>
  <tagtoken xml:id="i1005">
   <tags>
     <tag type="tok">with</tag>
     <tag type="cat">pp/np</tag>
     <tag type="sym">with</tag>
     <tag type="lemma">with</tag>
     <tag type="from">18</tag>
     <tag type="to">22</tag>
     <tag type="pos">IN</tag>
     <tag type="sem">REL</tag>
     <tag type="wordnet">O</tag>
     <tag type="verbnet" n="1">[Theme]</tag>
   </tags>
  </tagtoken>
  <tagtoken xml:id="i1006">
   <tags>
     <tag type="verbnet" n="0">[]</tag>
     <tag type="tok">ø</tag>
     <tag type="cat">np/n</tag>
     <tag type="wordnet">O</tag>
     <tag type="sense">0</tag>
     <tag type="sym">ø</tag>
     <tag type="lemma">ø</tag>
     <tag type="sem">DIS</tag>
     <tag type="from">23</tag>
     <tag type="to">-1</tag>
   </tags>
  </tagtoken>
  <tagtoken xml:id="i1007">
   <tags>
     <tag type="verbnet" n="0">[]</tag>
     <tag type="tok">pleasure</tag>
     <tag type="cat">n</tag>
     <tag type="sym">pleasure</tag>
     <tag type="lemma">pleasure</tag>
     <tag type="from">23</tag>
     <tag type="to">31</tag>
     <tag type="pos">NN</tag>
     <tag type="sem">CON</tag>
     <tag type="wordnet">O</tag>
   </tags>
  </tagtoken>
  <tagtoken xml:id="i1008">
   <tags>
     <tag type="tok">for</tag>
     <tag type="cat">(n\n)/np</tag>
     <tag type="sym">for</tag>
     <tag type="lemma">for</tag>
     <tag type="from">32</tag>
     <tag type="to">35</tag>
     <tag type="pos">IN</tag>
     <tag type="sem">REL</tag>
     <tag type="wordnet">O</tag>
     <tag type="verbnet" n="1">[Beneficiary]</tag>
   </tags>
  </tagtoken>
  <tagtoken xml:id="i1009">
   <tags>
     <tag type="verbnet" n="0">[]</tag>
     <tag type="tok">the</tag>
     <tag type="cat">np/n</tag>
     <tag type="sym">the</tag>
     <tag type="lemma">the</tag>
     <tag type="from">36</tag>
     <tag type="to">39</tag>
     <tag type="pos">DT</tag>
     <tag type="sem">DEF</tag>
     <tag type="wordnet">O</tag>
   </tags>
  </tagtoken>
  <tagtoken xml:id="i1010">
   <tags>
     <tag type="verbnet" n="0">[]</tag>
     <tag type="tok">date</tag>
     <tag type="cat">n</tag>
     <tag type="sym">time</tag>
     <tag type="lemma">time</tag>
     <tag type="from">40</tag>
     <tag type="to">44</tag>
     <tag type="pos">NN</tag>
     <tag type="sem">CON</tag>
     <tag type="wordnet">O</tag>
   </tags>
  </tagtoken>
  <tagtoken xml:id="i1011">
   <tags>
     <tag type="tok">in</tag>
     <tag type="cat">((s:ng\np)\(s:ng\np))/np</tag>
     <tag type="sym">in</tag>
     <tag type="lemma">in</tag>
     <tag type="from">45</tag>
     <tag type="to">47</tag>
     <tag type="pos">IN</tag>
     <tag type="sem">REL</tag>
     <tag type="wordnet">O</tag>
     <tag type="verbnet" n="1">[Location]</tag>
   </tags>
  </tagtoken>
  <tagtoken xml:id="i1012">
   <tags>
     <tag type="verbnet" n="0">[]</tag>
     <tag type="tok">the</tag>
     <tag type="cat">np/n</tag>
     <tag type="sym">the</tag>
     <tag type="lemma">the</tag>
     <tag type="from">48</tag>
     <tag type="to">51</tag>
     <tag type="pos">DT</tag>
     <tag type="sem">DEF</tag>
     <tag type="wordnet">O</tag>
   </tags>
  </tagtoken>
  <tagtoken xml:id="i1013">
   <tags>
     <tag type="verbnet" n="0">[]</tag>
     <tag type="tok">evening</tag>
     <tag type="cat">n</tag>
     <tag type="sym">evening</tag>
     <tag type="lemma">evening</tag>
     <tag type="from">52</tag>
     <tag type="to">59</tag>
     <tag type="pos">NN</tag>
     <tag type="sem">CON</tag>
     <tag type="wordnet">O</tag>
   </tags>
  </tagtoken>
  <tagtoken xml:id="i1014">
   <tags>
     <tag type="verbnet" n="0">[]</tag>
     <tag type="tok">.</tag>
     <tag type="cat">s:dcl\s:dcl</tag>
     <tag type="sym">.</tag>
     <tag type="lemma">.</tag>
     <tag type="from">59</tag>
     <tag type="to">60</tag>
     <tag type="pos">.</tag>
     <tag type="sem">NIL</tag>
     <tag type="wordnet">O</tag>
   </tags>
  </tagtoken>
 </taggedtokens>
 <drs label="b2">
  <domain>
   <dr label="b1" name="x1" from="0" to="-1"></dr>
   <dr label="b2" name="e1" from="10" to="17"></dr>
   <dr label="b2" name="x2" from="23" to="-1"></dr>
   <dr label="b2" name="t1" from="0" to="0"></dr>
   <dr label="b3" name="x3" from="48" to="51"></dr>
  </domain>
  <conds>
   <cond label="b1">
    <pred arg="x1" symbol="person" synset="person.n.01" from="0" to="5"></pred>
   </cond>
   <cond label="b1">
    <named arg="x1" symbol="frank" from="0" to="5"></named>
   </cond>
   <cond label="b2">
    <pred arg="t1" symbol="time" synset="time.n.01" from="40" to="44"></pred>
   </cond>
   <cond label="b2">
    <comp symbol="TPR" arg1="t1" arg2="now" from="6" to="9"></comp>
   </cond>
   <cond label="b2">
    <pred arg="t1" symbol="time" synset="time.n.08" from="6" to="9"></pred>
   </cond>
   <cond label="b2">
    <pred arg="e1" symbol="wait" synset="wait.v.01" from="10" to="17"></pred>
   </cond>
   <cond label="b2">
    <rel arg1="e1" arg2="t1" symbol="Time" framenet="Time" from="6" to="9"></rel>
   </cond>
   <cond label="b2">
    <rel arg1="e1" arg2="x3" symbol="Location" framenet="Containing@Container" from="45" to="47"></rel>
   </cond>
   <cond label="b2">
    <rel arg1="e1" arg2="x2" symbol="Theme" framenet="Activity_start@Activity" from="18" to="22"></rel>
   </cond>
   <cond label="b2">
    <rel arg1="e1" arg2="x1" symbol="Location" framenet="Process_continue@Place" from="10" to="17"></rel>
   </cond>
   <cond label="b2">
    <pred arg="x2" symbol="pleasure" synset="pleasure.n.01" from="23" to="31"></pred>
   </cond>
   <cond label="b2">
    <rel arg1="x2" arg2="t1" symbol="Beneficiary" framenet="Beneficiary" from="32" to="35"></rel>
   </cond>
   <cond label="b3">
    <pred arg="x3" symbol="evening" synset="evening.n.01" from="52" to="59"></pred>
   </cond>
  </conds>
 </drs>
</xdrs>
</xdrs-output>
