<?xml version="1.0" encoding="UTF-8"?>
<!DOCTYPE xdrs-output SYSTEM "src/dtd/xdrs.dtd">
<xdrs-output version="'boxer v1.00 (unix build on 21 May 2021, 16:29:40)'">
<!-- What ø Tom said does n't apply in this situation . --> 

<xdrs xml:id="xdrs1">
 <taggedtokens>
  <tagtoken xml:id="i1001">
   <tags>
     <tag type="tok">What</tag>
     <tag type="cat">np/(s:dcl/np)</tag>
     <tag type="sym">entity</tag>
     <tag type="lemma">entity</tag>
     <tag type="from">0</tag>
     <tag type="to">4</tag>
     <tag type="pos">WP</tag>
     <tag type="sem">QUE</tag>
     <tag type="wordnet">O</tag>
     <tag type="verbnet" n="1">[Equal]</tag>
   </tags>
  </tagtoken>
  <tagtoken xml:id="i1002">
   <tags>
     <tag type="verbnet" n="0">[]</tag>
     <tag type="tok">ø</tag>
     <tag type="cat">np/n</tag>
     <tag type="wordnet">O</tag>
     <tag type="sense">0</tag>
     <tag type="sym">ø</tag>
     <tag type="lemma">ø</tag>
     <tag type="sem">DEF</tag>
     <tag type="from">5</tag>
     <tag type="to">-1</tag>
   </tags>
  </tagtoken>
  <tagtoken xml:id="i1003">
   <tags>
     <tag type="verbnet" n="0">[]</tag>
     <tag type="tok">Tom</tag>
     <tag type="cat">n</tag>
     <tag type="sym">tom</tag>
     <tag type="lemma">tom</tag>
     <tag type="from">5</tag>
     <tag type="to">8</tag>
     <tag type="pos">NNP</tag>
     <tag type="sem">PER</tag>
     <tag type="wordnet">male.n.02</tag>
   </tags>
  </tagtoken>
  <tagtoken xml:id="i1004">
   <tags>
     <tag type="tok">said</tag>
     <tag type="cat">((s:dcl\np)/np)/(s:dcl\np)</tag>
     <tag type="sym">say</tag>
     <tag type="lemma">say</tag>
     <tag type="from">9</tag>
     <tag type="to">13</tag>
     <tag type="pos">VBD</tag>
     <tag type="sem">EPS</tag>
     <tag type="wordnet">O</tag>
     <tag type="verbnet" n="2">[Topic,Agent]</tag>
   </tags>
  </tagtoken>
  <tagtoken xml:id="i1005">
   <tags>
     <tag type="verbnet" n="0">[]</tag>
     <tag type="tok">does</tag>
     <tag type="cat">(s:dcl\np)/(s:b\np)</tag>
     <tag type="sym">do</tag>
     <tag type="lemma">do</tag>
     <tag type="from">14</tag>
     <tag type="to">18</tag>
     <tag type="pos">VBZ</tag>
     <tag type="sem">NOW</tag>
     <tag type="wordnet">O</tag>
   </tags>
  </tagtoken>
  <tagtoken xml:id="i1006">
   <tags>
     <tag type="verbnet" n="0">[]</tag>
     <tag type="tok">n't</tag>
     <tag type="cat">(s:dcl\np)\(s:dcl\np)</tag>
     <tag type="sym">not</tag>
     <tag type="lemma">not</tag>
     <tag type="from">18</tag>
     <tag type="to">21</tag>
     <tag type="pos">RB</tag>
     <tag type="sem">NOT</tag>
     <tag type="wordnet">O</tag>
   </tags>
  </tagtoken>
  <tagtoken xml:id="i1007">
   <tags>
     <tag type="tok">apply</tag>
     <tag type="cat">(s:b\np)/pp</tag>
     <tag type="sym">apply</tag>
     <tag type="lemma">apply</tag>
     <tag type="from">22</tag>
     <tag type="to">27</tag>
     <tag type="pos">VB</tag>
     <tag type="sem">EXS</tag>
     <tag type="wordnet">O</tag>
     <tag type="verbnet" n="1">[Agent]</tag>
   </tags>
  </tagtoken>
  <tagtoken xml:id="i1008">
   <tags>
     <tag type="tok">in</tag>
     <tag type="cat">pp/np</tag>
     <tag type="sym">in</tag>
     <tag type="lemma">in</tag>
     <tag type="from">28</tag>
     <tag type="to">30</tag>
     <tag type="pos">IN</tag>
     <tag type="sem">REL</tag>
     <tag type="wordnet">O</tag>
     <tag type="verbnet" n="1">[Location]</tag>
   </tags>
  </tagtoken>
  <tagtoken xml:id="i1009">
   <tags>
     <tag type="verbnet" n="0">[]</tag>
     <tag type="tok">this</tag>
     <tag type="cat">np/n</tag>
     <tag type="sym">this</tag>
     <tag type="lemma">this</tag>
     <tag type="from">31</tag>
     <tag type="to">35</tag>
     <tag type="pos">DT</tag>
     <tag type="sem">PRX</tag>
     <tag type="wordnet">O</tag>
   </tags>
  </tagtoken>
  <tagtoken xml:id="i1010">
   <tags>
     <tag type="verbnet" n="0">[]</tag>
     <tag type="tok">situation</tag>
     <tag type="cat">n</tag>
     <tag type="sym">situation</tag>
     <tag type="lemma">situation</tag>
     <tag type="from">36</tag>
     <tag type="to">45</tag>
     <tag type="pos">NN</tag>
     <tag type="sem">CON</tag>
     <tag type="wordnet">O</tag>
   </tags>
  </tagtoken>
  <tagtoken xml:id="i1011">
   <tags>
     <tag type="verbnet" n="0">[]</tag>
     <tag type="tok">.</tag>
     <tag type="cat">np\np</tag>
     <tag type="sym">.</tag>
     <tag type="lemma">.</tag>
     <tag type="from">45</tag>
     <tag type="to">46</tag>
     <tag type="pos">.</tag>
     <tag type="sem">NIL</tag>
     <tag type="wordnet">O</tag>
   </tags>
  </tagtoken>
 </taggedtokens>
 <drs label="b1">
  <domain>
   <dr label="b1" name="x1" from="0" to="4"></dr>
   <dr label="b2" name="x2" from="5" to="-1"></dr>
   <dr label="b1" name="e1" from="9" to="13"></dr>
   <dr label="b1" name="t1" from="9" to="13"></dr>
   <dr label="b1" name="e2" from="0" to="0"></dr>
  </domain>
  <conds>
   <cond label="b1">
    <pred arg="x1" symbol="entity" synset="entity.n.01" from="0" to="4"></pred>
   </cond>
   <cond label="b2">
    <pred arg="x2" symbol="male" synset="male.n.02" from="5" to="8"></pred>
   </cond>
   <cond label="b2">
    <named arg="x2" symbol="tom" from="5" to="8"></named>
   </cond>
   <cond label="b1">
    <pred arg="t1" symbol="time" synset="time.n.08" from="9" to="13"></pred>
   </cond>
   <cond label="b1">
    <comp symbol="TPR" arg1="t1" arg2="now" from="9" to="13"></comp>
   </cond>
   <cond label="b1">
    <pred arg="e1" symbol="say" synset="say.v.01" from="9" to="13"></pred>
   </cond>
   <cond label="b1">
    <rel arg1="e1" arg2="t1" symbol="Time" framenet="Time" from="9" to="13"></rel>
   </cond>
   <cond label="b1">
    <rel arg1="e1" arg2="x2" symbol="Agent" framenet="Agent" from="9" to="13"></rel>
   </cond>
   <cond label="b1">
    <rel arg1="e1" arg2="x1" symbol="Theme" framenet="Theme" from="9" to="13"></rel>
   </cond>
   <cond label="b1">
    <not from="18" to="21">
     <drs label="b3">
      <domain>
       <dr label="b3" name="e3" from="22" to="27"></dr>
       <dr label="b4" name="x3" from="31" to="35"></dr>
       <dr label="b1" name="t2" from="14" to="18"></dr>
      </domain>
      <conds>
       <cond label="b3">
        <rel arg1="e1" arg2="e3" symbol="Recipient" framenet="Recipient" from="9" to="13"></rel>
       </cond>
       <cond label="b1">
        <pred arg="t2" symbol="time" synset="time.n.08" from="14" to="18"></pred>
       </cond>
       <cond label="b1">
        <comp symbol="EQU" arg1="t2" arg2="now" from="14" to="18"></comp>
       </cond>
       <cond label="b3">
        <pred arg="e3" symbol="apply" synset="apply.v.01" from="22" to="27"></pred>
       </cond>
       <cond label="b3">
        <rel arg1="e3" arg2="t2" symbol="Time" framenet="Time" from="14" to="18"></rel>
       </cond>
       <cond label="b3">
        <rel arg1="e3" arg2="x3" symbol="Location" framenet="Containing@Container" from="28" to="30"></rel>
       </cond>
       <cond label="b3">
        <rel arg1="e3" arg2="x1" symbol="Agent" framenet="Placing@Agent" from="22" to="27"></rel>
       </cond>
       <cond label="b4">
        <pred arg="x3" symbol="situation" synset="situation.n.01" from="36" to="45"></pred>
       </cond>
      </conds>
     </drs>
    </not>
   </cond>
   <cond label="b1">
    <pred arg="e2" symbol="event" synset="event.v.01" from="0" to="0"></pred>
   </cond>
   <cond label="b1">
    <rel arg1="e2" arg2="x1" symbol="Participant" framenet="Participant" from="0" to="0"></rel>
   </cond>
  </conds>
 </drs>
</xdrs>
</xdrs-output>
